root@lamp-ubuntu-s-1vcpu-1gb-tor1-01:~# tcpdump -n -i eth0
tcpdump: verbose output suppressed, use -v[v]... for full protocol decode
listening on eth0, link-type EN10MB (Ethernet), snapshot length 262144 bytes
20:48:21.772677 IP 178.128.227.101.22 > 99.251.249.56.52933: Flags [P.], seq 792800750:792800938, ack 571743213, win 1113, length 188
20:48:21.791061 IP 99.251.249.56.52933 > 178.128.227.101.22: Flags [.], ack 4294967252, win 1021, length 0
20:48:21.798843 IP 99.251.249.56.52933 > 178.128.227.101.22: Flags [P.], seq 1:37, ack 4294967140, win 1021, length 36
20:48:21.799008 IP 178.128.227.101.22 > 99.251.249.56.52933: Flags [P.], seq 188:224, ack 37, win 1113, length 36
20:48:21.807053 IP 99.251.249.56.52933 > 178.128.227.101.22: Flags [.], ack 188, win 1020, length 0
20:48:21.827037 IP 99.251.249.56.52933 > 178.128.227.101.22: Flags [P.], seq 37:73, ack 188, win 1020, length 36
20:48:21.827244 IP 178.128.227.101.22 > 99.251.249.56.52933: Flags [P.], seq 224:260, ack 73, win 1113, length 36
20:48:21.859006 IP 99.251.249.56.52933 > 178.128.227.101.22: Flags [P.], seq 73:109, ack 224, win 1020, length 36
20:48:21.859203 IP 178.128.227.101.22 > 99.251.249.56.52933: Flags [P.], seq 260:296, ack 109, win 1113, length 36
20:48:21.874276 IP 178.128.227.101.22 > 99.251.249.56.52933: Flags [P.], seq 296:1372, ack 109, win 1113, length 1076
20:48:21.891375 IP 99.251.249.56.52933 > 178.128.227.101.22: Flags [P.], seq 109:145, ack 260, win 1019, length 36
20:48:21.891582 IP 178.128.227.101.22 > 99.251.249.56.52933: Flags [P.], seq 1372:1408, ack 145, win 1113, length 36
20:48:21.902992 IP 99.251.249.56.52933 > 178.128.227.101.22: Flags [.], ack 1372, win 1023, length 0
20:48:21.914899 IP 99.251.249.56.52933 > 178.128.227.101.22: Flags [P.], seq 145:181, ack 1372, win 1023, length 36
20:48:21.915090 IP 178.128.227.101.22 > 99.251.249.56.52933: Flags [P.], seq 1408:1444, ack 181, win 1113, length 36
20:48:21.945306 IP 99.251.249.56.52933 > 178.128.227.101.22: Flags [.], ack 1444, win 1023, length 0
20:48:21.951028 IP 99.251.249.56.52933 > 178.128.227.101.22: Flags [P.], seq 181:217, ack 1444, win 1023, length 36
20:48:21.951170 IP 178.128.227.101.22 > 99.251.249.56.52933: Flags [P.], seq 1444:1480, ack 217, win 1113, length 36
20:48:21.964878 IP 99.251.249.56.52933 > 178.128.227.101.22: Flags [P.], seq 217:253, ack 1444, win 1023, length 36
20:48:21.965063 IP 178.128.227.101.22 > 99.251.249.56.52933: Flags [P.], seq 1480:1516, ack 253, win 1113, length 36
20:48:21.978068 IP 178.128.227.101.22 > 99.251.249.56.52933: Flags [P.], seq 1516:1672, ack 253, win 1113, length 156
20:48:21.978366 IP 178.128.227.101.22 > 99.251.249.56.52933: Flags [P.], seq 1672:2852, ack 253, win 1113, length 1180
20:48:21.998938 IP 99.251.249.56.52933 > 178.128.227.101.22: Flags [.], ack 1516, win 1023, length 0
20:48:21.998938 IP 99.251.249.56.52933 > 178.128.227.101.22: Flags [P.], seq 253:289, ack 1516, win 1023, length 36
20:48:21.999121 IP 178.128.227.101.22 > 99.251.249.56.52933: Flags [P.], seq 2852:2888, ack 289, win 1113, length 36
20:48:22.014853 IP 99.251.249.56.52933 > 178.128.227.101.22: Flags [.], ack 2852, win 1023, length 0
20:48:22.026914 IP 99.251.249.56.52933 > 178.128.227.101.22: Flags [P.], seq 289:325, ack 2852, win 1023, length 36
20:48:22.027084 IP 178.128.227.101.22 > 99.251.249.56.52933: Flags [P.], seq 2888:2924, ack 325, win 1113, length 36
20:48:22.052806 IP 99.251.249.56.52933 > 178.128.227.101.22: Flags [.], ack 2924, win 1023, length 0
20:48:22.060918 IP 99.251.249.56.52933 > 178.128.227.101.22: Flags [P.], seq 325:361, ack 2924, win 1023, length 36
